{
  "$schema": "http://json-schema.org/draft-07/schema#",
  "type": "object",
  "additionalProperties": false,
  "required": ["meta", "executive_summary", "overview_table", "detailed",
               "tradeoff_summary", "key_questions", "vendor_questions", "flags", "changelog"],
  "properties": {
    "meta": {
      "type": "object", "additionalProperties": false,
      "required": ["vendor", "category", "version", "date", "sentiment"],
      "properties": {
        "vendor": {"type": "string"}, "category": {"type": "string"},
        "version": {"type": "string"}, "date": {"type": "string"},
        "sentiment": {"enum": ["positive", "neutral", "negative"]}
      }
    },
    "executive_summary": {
      "type": "object", "additionalProperties": false,
      "required": ["key_takeaway", "paragraphs", "suitability"],
      "properties": {
        "key_takeaway": {"type": "string"},
        "paragraphs": {"type": "array", "items": {"type": "string"}},
        "suitability": {"type": "string"}
      }
    },
    "overview_table": {
      "type": "array",
      "items": {
        "type": "object", "additionalProperties": false,
        "required": ["dimension", "focus_area", "result"],
        "properties": {
          "dimension": {"enum": ["SEE", "CHANGE", "ADAPT", "USE", "LEARN", "EXIT"]},
          "focus_area": {"type": "string"},
          "result": {"enum": ["Pass", "Partial", "Fail", "Insufficient"]}
        }
      }
    },
    "detailed": {
      "type": "array",
      "items": {
        "type": "object", "additionalProperties": false,
        "required": ["dimension", "focus_area", "score", "assessment", "trade_offs",
                     "vendor_questions", "confidence", "evidence_basis", "evidence_citations"],
        "properties": {
          "dimension": {"enum": ["SEE", "CHANGE", "ADAPT", "USE", "LEARN", "EXIT"]},
          "focus_area": {"type": "string"},
          "score": {"enum": ["Pass", "Partial", "Fail", "Insufficient"]},
          "assessment": {"type": "string"},
          "trade_offs": {
            "type": "object", "additionalProperties": false,
            "required": ["gain", "give_up"],
            "properties": {"gain": {"type": "string"}, "give_up": {"type": "string"}}
          },
          "vendor_questions": {"type": "array", "minItems": 1, "items": {"type": "string"}},
          "confidence": {"enum": ["high", "medium", "low"]},
          "evidence_basis": {"enum": ["verified", "vendor_claim", "inferred", "informative_absence", "user_provided", "insufficient"]},
          "evidence_citations": {"type": "array", "items": {"type": "string"}}
        }
      }
    },
    "tradeoff_summary": {
      "type": "array",
      "items": {
        "type": "object", "additionalProperties": false,
        "required": ["dimension", "result", "gain", "give_up"],
        "properties": {
          "dimension": {"enum": ["SEE", "CHANGE", "ADAPT", "USE", "LEARN", "EXIT"]},
          "result": {"enum": ["Pass", "Partial", "Fail", "Insufficient"]},
          "gain": {"type": "string"}, "give_up": {"type": "string"}
        }
      }
    },
    "key_questions": {"type": "array", "items": {"type": "string"}},
    "vendor_questions": {
      "type": "array",
      "items": {
        "type": "object", "additionalProperties": false,
        "required": ["id", "dimension", "question", "why_we_ask", "current_basis", "what_would_change"],
        "properties": {
          "id": {"type": "string"},
          "dimension": {"enum": ["SEE", "CHANGE", "ADAPT", "USE", "LEARN", "EXIT"]},
          "question": {"type": "string"}, "why_we_ask": {"type": "string"},
          "current_basis": {"type": "string"}, "what_would_change": {"type": "string"}
        }
      }
    },
    "flags": {
      "type": "array",
      "items": {
        "type": "object", "additionalProperties": false,
        "required": ["dimension", "type", "note"],
        "properties": {
          "dimension": {"enum": ["SEE", "CHANGE", "ADAPT", "USE", "LEARN", "EXIT", "OVERALL"]},
          "type": {"enum": ["insufficient", "informative_absence", "unverified_claim", "low_confidence", "org_context_dependent"]},
          "note": {"type": "string"}
        }
      }
    },
    "changelog": {
      "type": "array",
      "items": {
        "type": "object", "additionalProperties": false,
        "required": ["dimension", "change", "evidence"],
        "properties": {
          "dimension": {"enum": ["SEE", "CHANGE", "ADAPT", "USE", "LEARN", "EXIT", "OVERALL"]},
          "change": {"type": "string"}, "evidence": {"type": "string"}
        }
      }
    }
  }
}
